{
  "$schema": "https://json-schema.org/draft/2020-12/schema",
  "$id": "https://falak.sh/agent-protocol/commands/docker.compose.pull.schema.json",
  "title": "docker.compose.pull — write a project's files and pull its images (deploy FETCH for compose sites)",
  "type": "object",
  "additionalProperties": false,
  "required": [
    "project",
    "directory"
  ],
  "properties": {
    "project": {
      "type": "string",
      "pattern": "^[a-z0-9][a-z0-9_-]*$"
    },
    "directory": {
      "type": "string",
      "pattern": "^/"
    },
    "files": {
      "type": "array",
      "items": {
        "type": "object",
        "additionalProperties": false,
        "required": [
          "name",
          "content"
        ],
        "properties": {
          "name": {
            "type": "string",
            "pattern": "^[A-Za-z0-9_.-]+$"
          },
          "content": {
            "type": "string"
          }
        }
      },
      "description": "Written into directory before running; compose files are passed with -f in order. .env* files are written 0600 and not passed with -f."
    },
    "assets": {
      "type": "array",
      "maxItems": 200,
      "description": "Repository files the project mounts or reads, written to <directory>/repo/<path> (agent feature compose.v2).",
      "items": {
        "type": "object",
        "additionalProperties": false,
        "required": [
          "path",
          "content"
        ],
        "properties": {
          "path": {
            "type": "string",
            "maxLength": 512,
            "pattern": "^(?:[^./\\\\\\x00-\\x1f\\x7f][^/\\\\\\x00-\\x1f\\x7f]*|\\.[^./\\\\\\x00-\\x1f\\x7f][^/\\\\\\x00-\\x1f\\x7f]*|\\.\\.[^/\\\\\\x00-\\x1f\\x7f]+)(?:/(?:[^./\\\\\\x00-\\x1f\\x7f][^/\\\\\\x00-\\x1f\\x7f]*|\\.[^./\\\\\\x00-\\x1f\\x7f][^/\\\\\\x00-\\x1f\\x7f]*|\\.\\.[^/\\\\\\x00-\\x1f\\x7f]+))*$"
          },
          "content": {
            "type": "string",
            "contentEncoding": "base64"
          },
          "mode": {
            "type": "integer",
            "enum": [
              420,
              493
            ]
          }
        }
      }
    },
    "env": {
      "type": "object",
      "propertyNames": {
        "pattern": "^[A-Za-z_][A-Za-z0-9_]*$"
      },
      "additionalProperties": {
        "type": "string"
      },
      "description": "Process environment of the compose CLI (interpolation)"
    },
    "project_env_file": {
      "type": "string",
      "pattern": "^[A-Za-z0-9_.-]+$",
      "description": "File in directory passed as --env-file (e.g. .env)"
    },
    "registry_auth": {
      "type": "object",
      "additionalProperties": false,
      "required": [
        "username",
        "password"
      ],
      "properties": {
        "username": {
          "type": "string"
        },
        "password": {
          "type": "string"
        },
        "server": {
          "type": "string"
        }
      },
      "description": "Registry credentials for pulls (written to a throwaway DOCKER_CONFIG for the command)"
    },
    "services": {
      "type": "array",
      "items": {
        "type": "string",
        "pattern": "^[a-zA-Z0-9][a-zA-Z0-9_.-]*$"
      },
      "description": "Only these services (default: all)"
    },
    "mask": {
      "type": "array",
      "items": {
        "type": "string",
        "pattern": "^[A-Za-z_][A-Za-z0-9_]*$"
      },
      "uniqueItems": true,
      "description": "Names of the secret variables in this payload. The agent looks their values up in the payload (env maps, dotenv content) and masks them, plus their base64 and URL-encoded forms, as •••• in the command's output, error and result. Values shorter than 6 bytes are not masked."
    }
  },
  "$defs": {
    "result": {
      "type": "object",
      "additionalProperties": false,
      "required": [
        "exit_code"
      ],
      "properties": {
        "exit_code": {
          "type": "integer"
        }
      }
    }
  }
}
